{
  "budget": {
    "max_evaluations": null,
    "max_memory_mb": 2048.0,
    "max_walltime_sec": 60.0
  },
  "error_selfreport_dps80": "9.41442726303e-8",
  "expression": {
    "ast": {
      "args": [
        {
          "args": [
            {
              "op": "CONST",
              "value": "22/7"
            },
            {
              "args": [
                {
                  "args": [
                    {
                      "args": [
                        {
                          "op": "CONST",
                          "value": "9/16"
                        },
                        {
                          "args": [
                            {
                              "op": "CONST",
                              "value": "23/1"
                            }
                          ],
                          "op": "SQRT"
                        }
                      ],
                      "op": "MUL"
                    },
                    {
                      "op": "CONST",
                      "value": "-29/16"
                    }
                  ],
                  "op": "ADD"
                }
              ],
              "op": "SQRT"
            }
          ],
          "op": "MUL"
        },
        {
          "op": "CONST",
          "value": "-29/14"
        }
      ],
      "op": "ADD"
    },
    "format": "aeas-ast-v1"
  },
  "method": "aeas",
  "metrics": {
    "num_evaluations": 6577,
    "peak_memory_mb": 27.953125,
    "walltime_sec": 1.2991533329768572
  },
  "notes": "AEAS field-first adapter",
  "status": "success",
  "submitted_at": "2026-04-20T00:00:00Z",
  "task_id": "canb-poly-n13"
}
